{
  "kind": "pre-commit", "identity": "louke.contract.v0.14-002.pre-commit", "revision": "prism-round-3-remediation-candidate",
  "schema_ref": {"identity": "louke.machine-contract.pre-commit", "version": "1.0.0", "digest": "sha256:e3de3924390a95dc4816d00d22ef4a372801296ad0931b562b948416f911a7c9"},
  "manifest_ref": {"identity": "louke.design-artifacts.v0.14-002.prism-r3-remediation", "revision": "prism-round-3-remediation-candidate"},
  "scope": {"workspace_id": "github.com/zillionare/louke", "spec_id": "v0.14-002-workflow-reflow-design", "base_commit": "2734177ef5398e4c10a1f68039ec469ccc21f2b8", "project_facts_digest": "sha256:4b1a523c1cf946b480162e5321d3c92aeebdea75f57d5768948aee6f76672130", "project_facts_artifact": {"kind": "host-project-facts-snapshot", "path": "design-artifacts/inputs/host-project-facts.snapshot.json", "identity": "louke.host-project-facts.github.com-zillionare-louke", "revision": "base-2734177-workspace-2026-07-20-r2"}, "release_identity": "0.14.0"},
  "generated_by": {"owner": "Runtime/program", "role": "Archer", "task_manifest_digest": "sha256:0a9d58474340e9520af49d2bea462c41533c1fabc81afbcf4f5f292caecefbfc", "task_manifest_artifact": {"kind": "archer-author-task-manifest", "path": "design-artifacts/inputs/archer-author-task-manifest.candidate.json", "identity": "runtime.v0.14-002.m-design.archer.prism-r3-remediation", "revision": "prism-round-3-remediation-candidate"}}, "compatible_runtime": ">=0.14.0,<0.15.0",
  "artifact_refs": [
    {"path": ".louke/project/specs/v0.14-002-workflow-reflow-design/test-plan.md", "digest": "sha256:02a928e09f4abc80ae6ec0c60ec39ba33a131cfd5acc47dc3daeeab97cb4d53e", "ac_ids": ["AC-FR1000-01","AC-NFR0200-01"], "interface_ids": ["IF-DES-01","IF-CON-01","IF-PC-01","IF-CI-01","IF-AUD-01"], "architecture_anchors": ["ARC-DESIGN","ARC-CONTRACTS","ARC-CI","ARC-PRECOMMIT","ARC-STORE","ARC-SECURITY"], "contract_kind": "pre-commit"},
    {"path": ".louke/project/specs/v0.14-002-workflow-reflow-design/interfaces.md", "digest": "sha256:ce4e83ae0d0f614a43a1912e317859105f84f08ba53fc3e8b1cc150dd108e37f", "ac_ids": ["AC-FR1000-01"], "interface_ids": ["IF-PC-01"], "architecture_anchors": ["ARC-PRECOMMIT","ARC-STORE","ARC-SECURITY"], "contract_kind": "pre-commit"},
    {"path": ".louke/project/specs/v0.14-002-workflow-reflow-design/architecture.md", "digest": "sha256:32c88eb2062eb0173738086202eddf87122204ee99d32133c1ea30a6c39335cc", "ac_ids": ["AC-FR1000-01"], "interface_ids": ["IF-PC-01"], "architecture_anchors": ["ARC-PRECOMMIT","ARC-SECURITY"], "contract_kind": "pre-commit"}
  ],
  "payload": {"commands": [{"id": "precommit-run", "cwd": ".", "command": "pre-commit run --all-files", "implementation_state": "existing", "success": "All preserved and managed fast hooks return 0 without unreviewed modifications", "failure": "Any nonzero, timeout, missing preserved hook, drift, secret hit or file modification requiring review blocks commit"}, {"id": "precommit-install", "cwd": ".", "command": "pre-commit install", "implementation_state": "candidate-change-required", "success": "Runtime operation readback matches contract/config/stage digests", "failure": "Agent invocation, missing stage, drift or unknown fails; design/implementation Agent must not execute install"}], "managed_config_path": ".pre-commit-config.yaml", "tool_version": "4.6.0", "install_command": "pre-commit install", "stages": ["pre-commit"], "hooks": [{"id": "preserve-existing", "entry": "all existing local Keeper and third-party hook entries unchanged", "version": "read from base snapshot", "timeout_seconds": 120, "may_modify": true}, {"id": "louke-fast-quality", "entry": "format/lint/static/secret/AC-trace fast checks", "version": "v0.14-002 contract", "timeout_seconds": 120, "may_modify": true}], "existing_hook_snapshot": {"path": ".pre-commit-config.yaml", "policy": "digest and every repo/rev/id/entry/order read back before merge"}, "merge_policy": "preserve all existing hooks; add/update only owner-marked entries; external drift becomes conflict", "authoritative_full_gate": false, "readback": {"statuses": ["in_sync","drifted","missing","conflict"], "installer_authority": "Runtime only"}, "failure_policy": {"fail_closed": true, "non_success": ["nonzero","timeout","modified","missing","drifted","conflict","secret","unknown"], "current_state": "candidate-not-installed"}}
}
